{
  "$schema": "./hacktoberfest.schema.json",
  "year": 2026,
  "edition": "13th Edition",
  "owner": "Rudra Sanandiya",
  "username": "rudra1806",
  "tagline": "Open Source Contributor & Developer",
  "totalStickers": 24,
  "stickerBookUrl": "https://rudra1806.github.io/hacktoberfest-2026/",
  "stickers": [
    {
      "id": "key-authentication",
      "displayOrder": 1,
      "name": "Sign into Hacktoberfest.com",
      "shortName": "Auth Key",
      "category": "authentication",
      "earned": true,
      "featured": true,
      "earnedDate": "2026-10-01",
      "description": "Authenticated official Hacktoberfest account for the 2026 open source journey.",
      "image": "assets/hacktoberfest/stickers/key.png",
      "certificate": "assets/hacktoberfest/certificates/key-cert.png",
      "url": "https://hacktoberfest.com",
      "accentColor": "#3D5F58"
    },
    {
      "id": "mymlh-address",
      "displayOrder": 2,
      "name": "Add your address to your MyMLH account",
      "shortName": "Swag Address",
      "category": "profile",
      "earned": true,
      "featured": true,
      "earnedDate": "2026-10-01",
      "description": "Verified shipping address with MyMLH for official physical swag and digital perks.",
      "image": "assets/hacktoberfest/stickers/home.png",
      "certificate": "assets/hacktoberfest/certificates/home-cert.png",
      "url": "https://my.mlh.io",
      "accentColor": "#3D5F58"
    },
    {
      "id": "dev-account-connect",
      "displayOrder": 3,
      "name": "Connect your DEV account",
      "shortName": "DEV Connect",
      "category": "integration",
      "earned": true,
      "featured": true,
      "earnedDate": "2026-10-04",
      "description": "Connected DEV Community profile to publish articles and participate in hackathon challenges.",
      "image": "assets/hacktoberfest/stickers/dev-link.png",
      "certificate": "assets/hacktoberfest/certificates/dev-link-cert.png",
      "url": "https://dev.to",
      "accentColor": "#F5B726"
    },
    {
      "id": "dev-launch-challenge",
      "displayOrder": 4,
      "name": "Submit to the Hacktoberfest Launch Weekend DEV Challenge",
      "shortName": "Launch Challenge",
      "category": "challenge",
      "earned": true,
      "featured": true,
      "earnedDate": "2026-10-04",
      "description": "Submitted an open source project (NibbleNanny) for the official Launch Weekend DEV Challenge.",
      "image": "assets/hacktoberfest/stickers/dev-launch.png",
      "certificate": "assets/hacktoberfest/certificates/dev-launch-cert.png",
      "url": "https://dev.to/challenges",
      "accentColor": "#F5B726"
    },
    {
      "id": "discord-community",
      "displayOrder": 5,
      "name": "Join the Hacktoberfest Discord",
      "shortName": "Discord Community",
      "category": "community",
      "earned": true,
      "featured": true,
      "earnedDate": "2026-10-03",
      "description": "Joined the global Discord community of developers, maintainers, and open source enthusiasts.",
      "image": "assets/hacktoberfest/stickers/discord.png",
      "certificate": "assets/hacktoberfest/certificates/discord-cert.png",
      "url": "https://discord.gg/hacktoberfest",
      "accentColor": "#6C1D1C"
    },
    {
      "id": "pre-event-preparation",
      "displayOrder": 6,
      "name": "Complete Pre-Event Preparation",
      "shortName": "Prep Checklist",
      "category": "preparation",
      "earned": true,
      "featured": true,
      "earnedDate": "2026-10-01",
      "description": "Completed early registration and verified repo preparation checklist before launch.",
      "image": "assets/hacktoberfest/stickers/pre.png",
      "certificate": "assets/hacktoberfest/certificates/pre-cert.png",
      "url": "https://hacktoberfest.com",
      "accentColor": "#1E3A52"
    },
    {
      "id": "first-pull-request",
      "displayOrder": 7,
      "name": "First Accepted Pull Request",
      "shortName": "PR #1",
      "category": "contribution",
      "earned": false,
      "featured": false,
      "earnedDate": null,
      "description": "Submit your first pull request to an eligible open-source repository.",
      "image": null,
      "certificate": null,
      "url": "https://hacktoberfest.com",
      "accentColor": "#3D5F58"
    },
    {
      "id": "second-pull-request",
      "displayOrder": 8,
      "name": "Second Accepted Pull Request",
      "shortName": "PR #2",
      "category": "contribution",
      "earned": false,
      "featured": false,
      "earnedDate": null,
      "description": "Submit your second accepted pull request.",
      "image": null,
      "certificate": null,
      "url": "https://hacktoberfest.com",
      "accentColor": "#3D5F58"
    }
  ]
}
